<?xml version='1.0' encoding='utf-8' ?>
        <!-- DTD for a simple city -->

        <!ELEMENT Cities (City*)>
        <!ELEMENT City (name, x, y)>
        <!ATTLIST City
                name CDATA #REQUIRED
                x CDATA #REQUIRED
                y CDATA #REQUIRED
                >
