<!--
  ~ FreeRails
  ~ Copyright (C) 2000-2018 The FreeRails Team
  ~
  ~ This program is free software: you can redistribute it and/or modify
  ~ it under the terms of the GNU General Public License as published by
  ~ the Free Software Foundation, either version 3 of the License, or
  ~ (at your option) any later version.
  ~
  ~ This program is distributed in the hope that it will be useful,
  ~ but WITHOUT ANY WARRANTY; without even the implied warranty of
  ~ MERCHANTABILITY or FITNESS FOR A PARTICULAR PURPOSE.  See the
  ~ GNU General Public License for more details.
  ~
  ~ You should have received a copy of the GNU General Public License
  ~ along with this program.  If not, see <https://www.gnu.org/licenses/>.
  -->

<!DOCTYPE Tiles SYSTEM "cities.dtd">

<!--This file specifies the name and co-ordinates of the cities on a map-->

<Cities>

    <City name="Macapa" x="50" y="23"/>
    <City name="Belem" x="63" y="27"/>
    <City name="Sao Luis" x="80" y="35"/>
    <City name="Cuiaba" x="12" y="72"/>
    <City name="Miracema do Norte" x="50" y="50"/>
    <City name="Manaus" x="23" y="35"/>
    <City name="Macapa" x="50" y="23"/>
    <City name="Boa Vista" x="11" y="11"/>
    <City name="Paramaribo" x="48" y="3"/>
</Cities>
